{
 "config": "pdfluent-fast",
 "tool": "pdfluent_fast",
 "pages": 75,
 "page_names": [
  "ETR_2004_page_298.pdf",
  "HSY_2015_page_21.pdf",
  "BA_2018_page_34.pdf",
  "FCX_2017_page_86.pdf",
  "HSY_2007_page_93.pdf",
  "EXPE_2009_page_78.pdf",
  "ETR_2004_page_273.pdf",
  "ETR_2004_page_359.pdf",
  "HSY_2009_page_6.pdf",
  "ETR_2004_page_69.pdf",
  "HSY_2009_page_98.pdf",
  "BA_2004_page_96.pdf",
  "HSY_2007_page_43.pdf",
  "HSY_2009_page_112.pdf",
  "HSY_2007_page_79.pdf",
  "DVN_2014_page_112.pdf",
  "MNST_2012_page_107.pdf",
  "INTU_2018_page_43.pdf",
  "INTU_2018_page_75.pdf",
  "DVN_2014_page_51.pdf",
  "TDG_2009_page_37.pdf",
  "FDX_2007_page_51.pdf",
  "BA_2004_page_83.pdf",
  "TDG_2009_page_95.pdf",
  "MNST_2012_page_71.pdf",
  "3636528977ad5c44b4d00a5efc3d4735086090e7224cf17ff31cb4a95cac4120.pdf",
  "d19d3eb49082028d4c8c9d28dde645f1a7c14a659640c48204bb0705f51c3ef5.pdf",
  "b2b0a6c1e03eb55e7b119962920f12d96828ae255cd94d49c4dba0962ef5d3c3.pdf",
  "d68d359b0289d7fa515d48e75ea8e4ee6a70bd6d4991b95e84bdf178c119909d.pdf",
  "643941e0806596b2ed8834b5f22e4b336b6cf36a1d41543c34e50570e6255ec3.pdf",
  "f016f98ebe9c7596425a53e23f79adf42017af0cb4b9fe58d2722fe89ddf9174.pdf",
  "337b1ea1bfbf92dab50fecb838f6040a2041324fb6f772db69567c9bfe0ec3d8.pdf",
  "386dbb66a8666ae948f0dd405340ea1d3e3da315e89ea151281994a15ae41aa2.pdf",
  "4811d723f69ff47cd01b676a74649aa61ad2a0b02f8f9d899299ae1a576b89ea.pdf",
  "de943d48d85020628a2e70ac142d14647de76845e24c543dfc4e5053b3ad5299.pdf",
  "714e0207d7237e4550fdf988cfa8bd3aeee06e560367cf0d6ba36c25c18a9f7e.pdf",
  "8eecb197bee968839fd930396c407c9c24510bb6a415e180f4d4c9c5a108def7.pdf",
  "808136b7da653a8fb3ef57db9440ae4569cde53193a5ef5a8b631f6879ce63b9.pdf",
  "78501025603bc0d592fedd0fd9fc94e69830ccb92049a81c56a4c0c4f8499367.pdf",
  "8ecf4e2c7a3efd5c22a9bd4328eb30c0bf27f0326e57c80bfe6b89ab8ea4ffc2.pdf",
  "92330754d694921472fdbfc2bfe6def81d099e4d2d92d0d0c769a954d3b60096.pdf",
  "6db76d0a7f8a485592f9836c705dc8efb6bac66c6184fd63d4b51238ac4b1548.pdf",
  "7b782f1632aa485d2256080a19586f7f0e10f99ded330558a5f3e743153bacf1.pdf",
  "897f11637447c85dc787678d97428a7733736b7da11e65fadbeb92c3f11239ca.pdf",
  "477a76933cd1bf277e0b316f6427269721a7aecc22296f81353468f3b0e7b103.pdf",
  "dc5f96f61bed7ba0b18c719f30ffc520eac3aea84c6d0f83525dab0653d672d8.pdf",
  "42ee9a7cb0535fb59006a8d30e44975203082d78adb137d95df9914952a9b107.pdf",
  "8ba84c5085b7502b8a253d5ec429690884bfbc742a41f72a9462aec9511ffa09.pdf",
  "c871d52ca79ee91d5ee3c9ebf2b7ab451a5f1e4bad9530f9a95a938949db9ac5.pdf",
  "ff69aaffb9dcb6b8b682804fff48a54d96bf2d594ecae9749835dc048769213f.pdf",
  "PMC3141784-p0004.pdf",
  "PMC3141784-p0006.pdf",
  "PMC4826663-p0004.pdf",
  "PMC4826663-p0005.pdf",
  "PMC4826663-p0006.pdf",
  "PMC6222413-p0004.pdf",
  "PMC6222413-p0005.pdf",
  "PMC6019521-p0002.pdf",
  "PMC6019521-p0003.pdf",
  "PMC6019521-p0007.pdf",
  "PMC6212588-p0002.pdf",
  "PMC6212588-p0005.pdf",
  "PMC6212588-p0008.pdf",
  "PMC4817120-p0001.pdf",
  "PMC4817120-p0003.pdf",
  "PMC4352248-p0003.pdf",
  "PMC4352248-p0004.pdf",
  "PMC4352248-p0005.pdf",
  "PMC2676270-p0005.pdf",
  "PMC2676270-p0006.pdf",
  "PMC2676270-p0007.pdf",
  "PMC5724831-p0004.pdf",
  "PMC5724831-p0005.pdf",
  "PMC3616986-p0004.pdf",
  "PMC3616986-p0005.pdf"
 ],
 "reps": 3,
 "version": {
  "package": "pdfluent",
  "pinned": "1.1.0",
  "installed": "1.1.0",
  "matches_pin": true,
  "python": "/opt/ex/pdfluent_fast/bin/python"
 },
 "threads": {
  "1": {
   "label": "1",
   "how": "taskset -c 0 and thread variables = 1",
   "ms_p50": 20.0,
   "ms_p95": 50.8,
   "pages_per_s": 41.391,
   "peak_rss_mb": 42.8,
   "failed_pages": 0,
   "runs": [
    {
     "outcome": "ok",
     "wall_ms": 1966,
     "peak_rss_mb": 42.7,
     "laps_ms": [
      24,
      17,
      14,
      64,
      16,
      42,
      17,
      26,
      16,
      18,
      15,
      48,
      13,
      10,
      19,
      13,
      21,
      29,
      25,
      22,
      18,
      33,
      52,
      16,
      13,
      12,
      9,
      14,
      9,
      8,
      13,
      10,
      11,
      19,
      14,
      19,
      7,
      9,
      30,
      30,
      3,
      34,
      11,
      21,
      10,
      12,
      16,
      12,
      9,
      16,
      35,
      29,
      50,
      37,
      32,
      28,
      19,
      36,
      37,
      37,
      61,
      31,
      81,
      42,
      35,
      36,
      37,
      38,
      21,
      24,
      25,
      20,
      13,
      25,
      27
     ],
     "answered": 75,
     "failed": 0,
     "pages_per_s": 41.322
    },
    {
     "outcome": "ok",
     "wall_ms": 1966,
     "peak_rss_mb": 42.8,
     "laps_ms": [
      24,
      17,
      14,
      64,
      16,
      42,
      16,
      25,
      16,
      19,
      15,
      48,
      13,
      10,
      19,
      13,
      21,
      29,
      25,
      22,
      18,
      34,
      52,
      16,
      13,
      12,
      9,
      14,
      9,
      8,
      13,
      10,
      11,
      19,
      14,
      19,
      7,
      9,
      30,
      30,
      3,
      34,
      11,
      21,
      10,
      12,
      15,
      12,
      9,
      16,
      36,
      29,
      50,
      36,
      32,
      27,
      19,
      36,
      37,
      37,
      61,
      30,
      81,
      41,
      35,
      36,
      37,
      38,
      21,
      25,
      25,
      20,
      13,
      25,
      27
     ],
     "answered": 75,
     "failed": 0,
     "pages_per_s": 41.391
    },
    {
     "outcome": "ok",
     "wall_ms": 1966,
     "peak_rss_mb": 42.7,
     "laps_ms": [
      25,
      17,
      14,
      64,
      16,
      42,
      17,
      25,
      16,
      18,
      15,
      48,
      13,
      10,
      19,
      13,
      21,
      29,
      25,
      22,
      18,
      33,
      51,
      16,
      13,
      12,
      9,
      14,
      9,
      8,
      13,
      10,
      11,
      19,
      14,
      18,
      7,
      9,
      30,
      30,
      3,
      34,
      11,
      21,
      10,
      12,
      15,
      12,
      9,
      16,
      36,
      29,
      50,
      37,
      32,
      27,
      19,
      35,
      36,
      36,
      61,
      31,
      81,
      42,
      35,
      36,
      37,
      38,
      21,
      25,
      25,
      20,
      12,
      24,
      27
     ],
     "answered": 75,
     "failed": 0,
     "pages_per_s": 41.482
    }
   ]
  },
  "8": {
   "label": "all (8)",
   "how": "thread variables = 8",
   "ms_p50": 20.0,
   "ms_p95": 50.8,
   "pages_per_s": 41.345,
   "peak_rss_mb": 43.3,
   "failed_pages": 0,
   "runs": [
    {
     "outcome": "ok",
     "wall_ms": 1966,
     "peak_rss_mb": 43.1,
     "laps_ms": [
      24,
      17,
      14,
      64,
      16,
      42,
      17,
      26,
      16,
      18,
      15,
      48,
      13,
      10,
      19,
      13,
      21,
      29,
      25,
      22,
      18,
      33,
      51,
      16,
      13,
      12,
      9,
      14,
      9,
      8,
      13,
      10,
      11,
      19,
      14,
      19,
      7,
      9,
      30,
      30,
      3,
      34,
      11,
      21,
      10,
      12,
      15,
      11,
      9,
      16,
      35,
      29,
      50,
      37,
      32,
      28,
      19,
      36,
      36,
      37,
      61,
      31,
      82,
      42,
      35,
      36,
      37,
      38,
      21,
      25,
      25,
      20,
      12,
      25,
      27
     ],
     "answered": 75,
     "failed": 0,
     "pages_per_s": 41.391
    },
    {
     "outcome": "ok",
     "wall_ms": 1966,
     "peak_rss_mb": 43.3,
     "laps_ms": [
      24,
      17,
      14,
      64,
      16,
      43,
      17,
      26,
      16,
      19,
      15,
      48,
      13,
      10,
      19,
      13,
      21,
      28,
      25,
      22,
      18,
      34,
      52,
      16,
      13,
      12,
      9,
      14,
      9,
      8,
      13,
      10,
      11,
      19,
      14,
      19,
      8,
      9,
      30,
      30,
      3,
      33,
      11,
      22,
      10,
      12,
      15,
      11,
      9,
      16,
      35,
      29,
      50,
      37,
      31,
      28,
      20,
      36,
      37,
      36,
      61,
      31,
      82,
      43,
      35,
      36,
      37,
      38,
      21,
      24,
      25,
      20,
      13,
      24,
      27
     ],
     "answered": 75,
     "failed": 0,
     "pages_per_s": 41.3
    },
    {
     "outcome": "ok",
     "wall_ms": 1966,
     "peak_rss_mb": 42.8,
     "laps_ms": [
      24,
      17,
      14,
      64,
      16,
      42,
      17,
      26,
      16,
      19,
      15,
      48,
      12,
      10,
      19,
      13,
      21,
      29,
      25,
      22,
      18,
      34,
      51,
      16,
      13,
      12,
      9,
      14,
      9,
      8,
      13,
      10,
      11,
      19,
      14,
      19,
      8,
      9,
      30,
      30,
      3,
      34,
      11,
      22,
      10,
      12,
      15,
      11,
      9,
      16,
      35,
      28,
      50,
      37,
      32,
      28,
      19,
      35,
      37,
      37,
      61,
      31,
      81,
      42,
      35,
      36,
      37,
      38,
      21,
      25,
      25,
      20,
      13,
      25,
      27
     ],
     "answered": 75,
     "failed": 0,
     "pages_per_s": 41.345
    }
   ]
  }
 },
 "cold_start_ms": {
  "values": [
   113,
   113,
   113
  ],
  "median": 113,
  "what": "one fresh process, one page, start-up and model load included"
 },
 "sets": [
  "fintabnet",
  "doclaynet",
  "pubtables-1m",
  "parsebench"
 ]
}
